20201101,IT과학,서울경제,담원 소환사의 컵 들어올리자···관객석 상하이 도서관 됐다오지현의 하드캐리,담원 게이밍이 중국 상하이 푸동 아레나에서 개최된 ‘2020 리그오브레전드 월드 챔피언십’에서 지난달 31일 우승했다. 라이엇게임즈 서울경제 담원 게이밍이 2020년 ‘리그오브레전드 League of Legends·LoL 월드 챔피언십 롤드컵 ’ 우승 트로피를 들어 올렸습니다. 3년 만의 한국 팀 우승입니다. 담원으로서는 불과 창단 3년 만에 명실상부한 ‘세계 최강’ 반열에 올라서게 됐습니다. 가슴이 웅장하다 못해 뜨끈해지는 소식입니다. 담원은 지난달 31일 중국 상하이 푸동 아레나에서 열린 롤드컵에서 중국 리그인 LPL LoL 프로 리그 소속 ‘쑤닝 Suning ’을 세트 스코어 3 1로 꺾고 최종 우승했습니다. 롤드컵은 5판 3선승제로 담원이 무려 43분 간의 혈투가 이어진 끝에 1세트에서 선취점을 가져갔습니다. 쑤닝이 바로 2세트를 가져가면서 1 1 상황을 만들어 한때 긴장감이 더해지기도 했는데요. 특히 2세트 마지막 한타에서는 쑤닝 소속 빈 본명 천쩌빈 선수의 피오라에게 ‘펜타킬 5연속 킬 ’을 내주는 가슴 아픈 장면이 연출됐습니다. 쑤닝 팀이 지난달 31일 중국 상하이 푸동 아레나에서 진행된 ‘2020 리그오브레전드 월드 챔피언십’ 결승전에 임하고 있다. 라이엇게임즈 그러나 담원의 멘탈은 단단했습니다. 3세트에서는 톱 라이너 ‘너구리 본명 장하권 ’ 선수의 케넨이 ‘소드아트 본명 후숴제 ’를 잡아내며 그대로 쑤닝을 함락시켰습니다. 4세트는 싱거울 정도였죠. ‘캐니언 본명 김건부 ’ 선수의 킨드레드가 빠르게 성장해 초반부터 10킬 이상 격차가 벌어지며 담원이 우승컵을 손에 넣게 됐습니다. 특히 담원은 든든하다고 해서 ‘국밥’으로 불리는 챔피언을 적극 활용했습니다. 대표적인 국밥 챔프 오른이 담원의 탑 라인을 3세트 동안 지켰습니다. 1세트에서는 대표 국밥 조합인 ‘오른 탑 오리아나 미드 ’를 선택하기도 했죠. 전반적으로 엎치락뒤치락 교전이 계속되면서 결승전다운 팽팽한 경기가 만들어졌다는 평입니다. 3세트 말미 너구리 선수가 팀 보이스를 통해 “정신 나갈 것 같다”고 언급할 만큼 치열한 접전이 이어졌습니다. LCK 소속 담원 게이밍은 지난달 31일 중국 상하이 푸동 아레나에서 개최된 ‘2020 리그오브레전드 월드 챔피언십’ 결승전에서 LPL 소속 쑤닝을 꺾고 우승했다. 라이엇게임즈 LCK LoL 챔피언스 코리아 의 설욕전이라는 관점에서 이번 한중전을 지켜본 팬분들이 많으실 텐데요. 이날 경기는 쑤닝의 홈구장에서 유관중으로 진행돼 6 000여명의 중국 관객들이 함께 했습니다. 그만큼 쑤닝이 ‘홈 어드밴티지’를 가져간 거죠. 한국을 대표한다는 선수들의 부담감 역시 인게임 보이스에서 그대로 전해졌습니다. 이에 대해 마지막 세트 경기 중 ‘쇼메이커 본명 허수 ’ 선수가 한 말이 곧바로 화제가 됐습니다. “도서관 만들어. ‘상하이 라이브러리’ 만들어버려. 감정표현 박아.” 중국 관객들이 쑤닝을 응원 중인 관중석을 쥐죽은 듯이 조용한 ‘도서관’으로 만들어버리겠다는 엄포입니다. LCK 팬들 사이에선 그야말로 ‘사이다’ 발언이라는 평이 나왔습니다. 너구리 선수는 경기 직후 인터뷰를 통해 “LCK가 다시 일어서는 시작점이 된 것 같아서 영광이고 기분이 좋다”며 “내년에도 열심히 해서 좋은 성적 낼 수 있도록 하겠다”는 소감을 밝혔습니다. 이번 롤드컵 우승은 담원의 ‘2부 신화’를 썼다는 점에서도 특별합니다. 담원은 LCK 2부 리그인 ‘LoL 챌린저스 코리아’ 출신입니다. 2017년 창단 후 이듬해 챌린저스 서머 시즌에서 우승하면서 지난해 LCK로 승격됐습니다. 그리고 올해 서머 시즌 압도적인 성적으로 1시드로 롤드컵에 직행했습니다. 2부 리그 출신 팀 최초로 LCK와 롤드컵 우승을 한꺼번에 이뤘으니 그야말로 ‘소년만화’ 같은 이야깁니다. 담원 게이밍 소속 고스트 본명 장용준 선수. 라이엇게임즈 오랜 기간 프로게이머 생활을 하며 고전한 ‘고스트 본명 장용준 ’ 선수의 이야기를 빼놓을 수 없겠죠. 고스트 선수는 16세 나이에 데뷔해 CJ 엔투스 bbq 올리버스 샌드박스 게이밍 등 3개 팀에서 프로 생활을 했습니다. 6년간 팀의 구멍이라는 혹평을 받았고 승률도 좋지 않았죠. 무엇보다 LCK 승강전에서 2번이나 강등당하는 아픔을 맛봤습니다. 지난 2018년 시즌 후 한 인터뷰에서 “이렇게 200전 가까이 플레이한 선수 중에 나만큼 성과를 못 낸 선수가 있을까. 그냥 못하는 선수라면 그만하는 게 맞다는 생각도 했다”고 심경을 밝히기도 했습니다. 반전은 짜릿한 법입니다. 고스트 선수는 마침내 LCK 우승과 롤드컵 우승을 동시에 이뤄내는 대역전극을 썼습니다. 쑤닝을 상대로 숨 돌릴 틈 없이 몰아붙인다고 하는 ‘무호흡 딜링’까지 선보였습니다. 결승전 직후 인터뷰에서 “힘든 친구들도 저를 보고 ‘저랬던 친구도 월즈 롤드컵 우승 할 수 있구나’ 하고 다들 힘을 받고 포기하지 않고 열심히 해서 좋은 성과 거두면 좋겠다”라는 소감을 전했습니다. ‘2020 리그오브레전드 월드 챔피언십’ 키 이미지. 라이엇게임즈 캐니언 선수는 최고의 활약을 펼친 선수에게 주어지는 호칭인 MVP로 꼽혔는데요. 4세트에서 킨드레드를 플레이 해 8킬 노데스 7어시스트로 맹활약했습니다. 캐니언 선수는 “대회 도중 인터뷰에서 목표가 우승하고 MVP 받는 것이라고 말했는데 이렇게 이뤄져 믿기지 않고 기쁘다”라며 “올해 어느 팀보다 열심히 했는데 이 때문에 좋은 성적을 낸 것 같다. 열심히 응원해주신 팬들에게 감사하다”고 말했습니다. 올해 롤드컵 테마는 ‘쟁취하라 Take over ’였습니다. 2부 리그에서 시작해 LPL로부터 우승컵을 다시 되찾아온 담원의 경기는 “쟁취한다”라는 테마에 걸맞은 모습이었습니다. 담원의 역사는 이제 시작입니다.,https://news.naver.com/main/read.nhn?mode=LSD&mid=sec&sid1=105&oid=011&aid=0003818946
20201101,IT과학,조선비즈,LG전자 韓캐나다 AI 전문가 모이는 연례포럼 첫 개최,토론토서 ‘AI 포럼 앤 디스커버리 워크숍’ 진행 LG전자가 지난달 28일부터 3일간 AI 전문가들과 함께 인공지능의 발전방향을 논의하는 ‘AI 포럼 앤 디스커버리 워크숍’을 처음으로 열었다.LG전자 토론토대학교 캐나다고등연구원 소속의 AI 전문가들이 온라인 화상회의 형식으로 진행된 AI 포럼에 참여했다. LG전자 제공 LG전자 066570 가 한국과 캐나다의 인공지능 AI 전문가들이 모여 상호 발전을 도모하는 논의의 장을 만들었다. LG전자는 지난달 28일부터 3일간 LG전자 토론토 AI연구소에서 ‘AI 포럼 앤 디스커버리 워크숍 AI Forum Discovery Workshop ’을 진행했다고 1일 밝혔다. 이 포럼은 양국 학계가 협업해 AI 기술과 산업을 발전시키기 위한 논의를 하기 위한 자리로 올해를 시작으로 매년 한차례 열릴 예정이다. 박일평 LG전자 최고기술책임자 CTO 와 캐나다고등과학연구원 CIFAR 토론토대 소속 전문가 16명이 참석해 발표와 토론을 가졌다. 첫날 기조연설에서는 박 CTO와 엘리사 스트롬 CIFAR 박사가 각각 AI 중심의 디지털 전환 방향과 전세계 산·학의 협력 필요성을 제시했다.,https://news.naver.com/main/read.nhn?mode=LSD&mid=sec&sid1=105&oid=366&aid=0000612281
20201101,IT과학,전자신문,SK텔레콤 언택트 여행 여행ON기분 캐나다편 공개,SK텔레콤 여행ON기분 캐나다편 SK텔레콤이 코로나19 시대 영상으로 해외 현지를 생생하게 체험하는 언택트 여행 이벤트 여행ON기분 캐나다편을 1일 공개했다. 여행ON기분은 SK텔레콤이 온라인을 통해 현지 유명 관광지 구석구석을 소개하는 자체 기획 이벤트다. 앞서 7월 파리편을 선보이며 해외 인기 관광지를 생생하게 전달했다. 여행ON기분 캐나다편은 캐나다관광청과 협력 제작했다. 현지 전문 가이드와 현지 관광청 직원이 출연 한국인 관광객에게 인기가 많은 캐나다 관광지에 대한 정보를 제공한다. 영상을 통해 세계 단풍 명소 메이플로드 풍경 나이아가라 폭포에서 즐기는 크루즈 와이너리 투어 등 다양한 체험을 전달할 예정이다. 역사적 마을과 상점 등 캐나다 일상을 엿볼 수 있는 장면도 담았다. 캐나다관광청 관계자는 “힘든 시간을 겪는 모두에게 캐나다 대자연을 감상하며 위로가 되길 바라는 마음에서 협업을 제안했다”며 “신비로운 대자연을 통해 잠시나마 근심과 걱정을 내려놓을 수 있기를 바란다”고 전했다. 송광현 SK텔레콤 PR2실장은 “코로나19 여파로 여행을 떠나기 어려운 고객에게 즐겁고 색다른 경험을 제공하기 위해 콘텐츠를 기획했다”며 “SK텔레콤은 앞으로도 5G·인공지능 AI 등 정보통신기술 ICT 을 이용해 고객에게 즐거움을 드리기 위해 노력할 것”이라고 말했다. 여행ON기분 캐나다편은 SK텔레콤 공식 유튜브 채널에서 시청할 수 있다.,https://news.naver.com/main/read.nhn?mode=LSD&mid=sec&sid1=105&oid=030&aid=0002910536
20201101,IT과학,뉴스1,LG전자 인공지능 강국 캐나다의 인재들과 머리 맞대다,서울 뉴스1 김진환 기자 LG전자 토론토대학교 캐나다고등연구원 소속의 AI 전문가들이 온라인 화상회의 형식으로 진행된 AI 포럼에 참여하고 있다. LG전자는 지난달 28일부터 3일간 AI 전문가들과 함께 인공지능의 발전방향을 논의하는 ‘AI 포럼 앤 디스커버리 워크숍’을 처음으로 열었다.,https://news.naver.com/main/read.nhn?mode=LSD&mid=sec&sid1=105&oid=421&aid=0004963012
20201101,IT과학,뉴스1,LG전자 AI 포럼 앤 디스커버리 워크숍 개최,서울 뉴스1 김진환 기자 LG전자 토론토대학교 캐나다고등연구원 소속의 AI 전문가들이 온라인 화상회의 형식으로 진행된 AI 포럼에 참여하고 있다. LG전자는 지난달 28일부터 3일간 AI 전문가들과 함께 인공지능의 발전방향을 논의하는 ‘AI 포럼 앤 디스커버리 워크숍’을 처음으로 열었다.,https://news.naver.com/main/read.nhn?mode=LSD&mid=sec&sid1=105&oid=421&aid=0004963011
20201101,IT과학,뉴스1,LG전자 첫 ‘AI 포럼’ 개최,서울 뉴스1 김진환 기자 LG전자 토론토대학교 캐나다고등연구원 소속의 AI 전문가들이 온라인 화상회의 형식으로 진행된 AI 포럼에 참여하고 있다. LG전자는 지난달 28일부터 3일간 AI 전문가들과 함께 인공지능의 발전방향을 논의하는 ‘AI 포럼 앤 디스커버리 워크숍’을 처음으로 열었다.,https://news.naver.com/main/read.nhn?mode=LSD&mid=sec&sid1=105&oid=421&aid=0004963010
20201101,IT과학,디지털타임스,조달청 입찰정보주간 신기술 용역·물품구매,조달청은 이번 한 주 동안 방위사업청의 군수지원분석체계 고도화 사업 등 162건 716억원 상당의 신기술·서비스 용역과 대구시교육청의 학교 스마트단말기 도입 사업 등 347건 2647억원 상당의 물품구매 입찰을 집행한다. 신기술·서비스 용역에서 방위사업청의 군수지원분석체계 고도화 사업 은 33억8700만원 규모로 협상계약을 통해 오는 3일 개찰한다. 또한 한국산업기술평가관리원의 2020년 정보서비스 운영 및 유지관리 사업 과 한국언론진흥재단의 공용인프라 운영 등 클라우드 서비스 이용 사업 이 각각 37억8200만원 36억1100만원 규모로 진행된다. 물품구매로는 대구시교육청의 학교 스마트단말기 도입 사업 이 183억1100만원 규모로 협상계약을 통해 오는 4일 개찰한다. 또 전북 장수군의 장수군 폐기물처리시설 소각시설 구매 제작·설치 와 해양경찰청의 LNG 방제정 탑재 유회수 시스템 제조 구매 가 각각 33억5900만원 28억9400만원 규모로 진행된다. 지역별로 대전 소재 본청 645억원 서울지방청 311억원 등 2개 청이 전체 금액의 35.2%를 차지하며 서울 등 10개 지방청은 1761억원을 각각 집행한다.,https://news.naver.com/main/read.nhn?mode=LSD&mid=sec&sid1=105&oid=029&aid=0002633557
20201101,IT과학,연합뉴스,KT 우크라이나 에너지 효율화 나선다,KT·우크라이나 에너지부 전력 스마트미터링 업무협약 서울 연합뉴스 KT 김영우 글로벌사업본부장 상단 가운데 과 우크라이나 올가 부스라뷔에트 에너지부 장관 하단 이 화상으로 업무협약을 체결한 후 기념사진을 촬영하는 모습. 2020.11.01. KT 제공. 재판매 및 DB 금지 서울 연합뉴스 김잔디 기자 KT는 우크라이나 에너지부 Ministry of Energy of Ukraine 와 우크라이나 에너지 효율화를 위한 전력 스마트미터링 신규 비즈니스 개발 업무협약 MOU 을 체결했다고 1일 밝혔다. 스마트미터링은 계량기와 사물인터넷 IoT 기술을 융합해 공급자와 수요자가 원격에서 실시간으로 전력 사용량을 확인할 수 있게 하는 에너지 측정 방식이다. 두 기관은 우크라이나에 전력 스마트미터링 시스템을 구축하고 전국의 전력 사용량을 실시간으로 관제·분석해 에너지 효율화를 추진한다. KT는 스마트미터링 관련 기술 및 노하우 전수 전력 분야 전문가 방문 교류 및 교육 사업 타당성 조사 등을 통해 신규 비즈니스 모델을 발굴할 예정이다. 인공지능 AI 과 빅데이터를 활용한 에너지 관제 기술로 현지 에너지 관제 솔루션도 개발하기로 했다. KT는 AI를 활용해 에너지 관제뿐만 아니라 발전량 진단 예측 최적제어 생산 소비 거래 등 전 분야를 통합 관리하는 솔루션을 국내에서 제공하고 있다. KT 글로벌사업본부장 김영우 상무는 우크라이나 전력시장에 진출할 수 있는 정책적 파트너와의 협력 체계를 구축했다 며 우크라이나 전력시장 발전을 위해 KT의 에너지 사업에 대한 경험과 AI·빅데이터를 결합한 솔루션을 적극적으로 활용할 것 이라고 말했다. 우크라이나 에너지부 올가 부스라뷔에트 장관 Acting Minister Olha Buslavets 은 KT가 보유한 에너지 관련 사업 경험과 우수한 기술력을 활용해 급변하는 우크라이나 에너지산업에 변화를 만들어 낼 수 있을 것 이라고 말했다.,https://news.naver.com/main/read.nhn?mode=LSD&mid=sec&sid1=105&oid=001&aid=0011984327
20201101,IT과학,아이뉴스24,KT 우크라이나에 전력 스마트미터링 기술 수출,정책적 파트너십 마련… 우즈베키스탄 이어 신북방경제협력 박차 KT 김영우 글로벌사업본부장 왼쪽 과 우크라이나 올가 부스라뷔에트 에너지부 장관 오른쪽 이 화상으로 MOU를 체결하고 있는 모습 출처 KT 아이뉴스24 송혜리 기자 KT 전력 스마트미터링 기술이 우크라이나에 수출된다. 스마트미터링은 계량기와 IoT기술을 융합해 공급자와 수요자가 원격에서 실시간으로 전력 사용량을 확인할 수 있게 하는 에너지 측정 방식이다. KT 대표 구현모 는 우크라이나 에너지부 Ministry of Energy of Ukraine 와 우크라이나 에너지 효율화를 위한 전력 스마트미터링 신규 비즈니스 개발 업무협약 MOU 을 체결했다고 1일 발표했다. 이번 협약을 통해 양 기관은 우크라이나에 전력 스마트미터링 시스템을 구축하고 전국의 전력 사용량을 실시간으로 관제·분석해 에너지 효율화를 추진한다. KT는 스마트미터링 관련 기술 및 노하우 전수 전력분야 전문가 방문 교류 및 교육 사업타당성 조사 진행 등을 통해 신규 비즈니스 모델을 발굴할 예정이다. 특히 KT는 AI·빅데이터 등을 활용한 에너지 관제 기술을 적용해 우크라이나의 에너지 관제 솔루션을 개발할 계획이다. KT는 AI 엔진 eBrain 을 탑재한 KT MEG Micro Energy Grid 을 통해 에너지 관제뿐만 아니라 발전량 진단 예측 최적제어 생산 소비 거래 등 전분야를 통합 관리하는 솔루션을 국내에서 제공하고 있다. 앞서 KT는 우즈베키스탄 스마트미터링 구축 사업으로 전력 스마트미터기·시스템을 설치했고 이를 관리할 수 있는 국가에너지 데이터 센터를 지난 8월에 개통했다. KT는 이러한 해외 사업 경험을 기반으로 인근 신북방경제협력 국가들로 사업 확장을 모색하고 있다. 또 KT는 9월 우크라이나 흐멜니츠키주 60만 가입자의 전력공급을 담당하고 있는 흐멜니츠키 전력회사 Khmelnytsk Oblenergo 와 사업개발 추진을 위한 업무협약 MOU 을 체결해 스마트미터링 사업을 협의 중이다. 김영우 KT 글로벌사업본부장 상무 는 이번 협약을 통해 우크라이나 전력시장에 진출할 수 있는 정책적 파트너와의 협력 체계를 구축했다 며 우크라이나 전력시장 발전을 위해 KT의 에너지 사업에 대한 경험과 AI·빅데이터를 결합한 솔루션을 적극 활용할 것 이라고 말했다.,https://news.naver.com/main/read.nhn?mode=LSD&mid=sec&sid1=105&oid=031&aid=0000565781
20201101,IT과학,연합뉴스,영상으로 즐기는 여행 SKT 언택트 여행 캐나다편 공개,서울 연합뉴스 SK텔레콤은 코로나19로 여행을 떠나기 어려운 시기에 영상으로 현지를 생생하게 관광하는 이색 경험을 제공하는 언택트 여행 이벤트 여행ON기분 캐나다편을 공개한다고 1일 밝혔다. 사진은 SK텔레콤 공식 유튜브 채널에 게재된 관련 영상의 캡처 화면이다. 2020.11.01. SK텔레콤 제공. 재판매 및 DB 금지 서울 연합뉴스 김잔디 기자 SK텔레콤은 영상으로 현지를 생생하게 체험할 수 있는 언택트 여행 이벤트 여행ON기분 캐나다편을 공개한다고 1일 밝혔다. 여행ON기분 은 신종 코로나바이러스 감염증 코로나19 유행으로 직접 방문하기 어려운 유명 관광지 구석구석을 소개하는 SKT의 이벤트다. 지난 7월 파리편을 선보이며 하와이 등 인기 관광지를 국내 시청자에 전달해왔다. 캐나다편에는 캐나다관광청과의 협력을 통해 한국인 관광객에 인기가 많은 현지 관광지에 대한 풍성한 정보를 담았다. 세계적 단풍 명소 메이플로드의 멋진 풍경과 함께 나이아가라 폭포에서 즐기는 크루즈 와이너리 투어 등 다양한 체험을 전달할 예정이다. 캐나다편은 SKT 공식 유튜브 채널에서 시청할 수 있다. 서울 연합뉴스 SK텔레콤은 코로나19로 여행을 떠나기 어려운 시기에 영상으로 현지를 생생하게 관광하는 이색 경험을 제공하는 언택트 여행 이벤트 여행ON기분 캐나다편을 공개한다고 1일 밝혔다. 사진은 SK텔레콤 공식 유튜브 채널에 게재된 관련 영상의 캡처 화면이다.,https://news.naver.com/main/read.nhn?mode=LSD&mid=sec&sid1=105&oid=001&aid=0011984325
20201101,IT과학,디지털데일리,지상파·OTT와 경쟁 대신 협력…B tv 콘텐츠 영역확장,디지털데일리 권하영기자 SK브로드밴드가 IPTV 서비스 ‘B tv’를 중심으로 달라진 미디어 시장을 새롭게 공략하고 있다. 기존 레거시 미디어인 지상파와 뉴 플레이어로 등장한 온라인동영상서비스 OTT 사이를 잇는 IPTV 플랫폼의 강점을 살려 콘텐츠 경쟁력을 강화하는 모습이다. 최근 선보인 ‘좀비탐정’ 성공에 힘입어 오리지널 투자에도 본격적으로 나선다. 30일 SK브로드밴드가 KBS·웨이브와 공동으로 제작에 투자한 최초 오리지널 콘텐츠 ‘좀비탐정’은 지상파보다 앞서 B tv에서 VOD로 방영되면서 높은 인기를 끌고 있다. 실제로 SK브로드밴드가 ‘좀비탐정’의 VOD 시청건수를 분석한 결과 9월19일 첫방송부터 10월17일 7 8회까지 전체 시청건수 가운데 ‘오션’ 영화월정액 은 40.7% 지상파월정액은 33.5%가 지상파 본방송 전에 좀비탐정을 시청했다. 좀비탐정은 ‘오션’에서 전체 시청시간 2위 토요일 저녁 선공개 후 일 화요일 3일간 1위를 유지했다. 특히 이 기간에는 2위 콘텐츠보다 2 3배 높은 시청시간을 기록할 정도로 관심이 높았다. 지상파월정액 가입자들 사이에서도 시청시간 상위권에 들었다. 지금까지는 지상파 채널에서 먼저 실시간방송을 내보내고 이후 일정 시간이 지나면 IPTV에서 VOD로 뜨는 것이 일반적이었다. 이번에는 지상파보다 앞서 IPTV와 OTT에서 두편의 VOD로 동시 공개하는 새로운 시도를 통해 성과를 냈다는 평가다. 이는 최근 국내 미디어시장이 전통적인 지상파와 케이블TV 중심에서 IPTV와 OTT로 중심부를 옮기면서 급속한 변화를 맞는 배경과 맞닿아 있다. OTT의 등장으로 지상파와 유료방송 또한 시즌제 드라마나 오리지널 콘텐츠로 영역을 넓히는 추세다. SK브로드밴드는 앞서 기존 IPTV 브랜드 ‘B tv’를 ‘러블리 B tv’로 전면개편하고 기존 TV방송 위주 콘텐츠에서 B tv 영화 월정액 서비스인 ‘오션 OCEAN ’을 새롭게 선보여 콘텐츠 경쟁력을 강화한 바 있다. 특히 오션의 영화 콘텐츠 커버리지는 올해 말 국내의 경우 98% 해외 경우 89%까지 더 확대시킬 계획을 갖고 있다. 또한 키즈 콘텐츠 영역에서는 기존 영·유아와 초등학교 저학년 대상에서 초등학교 중·고학년 대상 학습형 콘텐츠로 확대하고 기존 시니어 전용관 ‘VIVA 시니어’는 ‘해피 시니어’로 개편해 전용 UI와 맞춤형 월정액 요금제를 출시하는 등 키즈와 시니어 시장에서 모두 좋은 반응을 얻고 있다는 평가다. SK브로드밴드는 기존 콘텐츠 경쟁력 강화에 이어 오리지널 콘텐츠에 대한 투자도 계속 확대할 방침이다. ‘좀비탐정’ 시즌2 제작 가능성도 열려 있다. 향후 비즈니스 파트너들과 함께 예능과 다큐 등 다양한 장르에서 오리지널 콘텐츠 제작투자에 적극 협력해 글로벌 OTT와의 경쟁에서도 앞서가겠다는 목표다.,https://news.naver.com/main/read.nhn?mode=LSD&mid=sec&sid1=105&oid=138&aid=0002093960
20201101,IT과학,디지털데일리,KT ‘UN지속가능개발목표경영지수’ 2년연속 1위,디지털데일리 권하영기자 KT는 ‘2020 유엔 UN 지속가능개발목표경영지수 SDGBI ’에서 1위그룹에 2년연속 선정됐다고 1일 밝혔다. UN 경제사회이사회 특별협의지위기구 ‘UN SDGs협회’가 발표한 이번 평가에서는 전 세계 약 3000개 기업 가운데 300개 기업이 글로벌지수에 편입됐다. KT는 네슬레 테슬라 아디다스 화이자 등 8개의 글로벌 기업과 함께 국내에서 유일하게 공동 1위에 올랐다. KT는 지난 2016년부터 SDGBI 국내지수 3년 연속 1위 지난해부터 2년연속 글로벌지수 1위 그룹에 선정됐다. 협회는 KT가 노사공동나눔협의체 UCC활동을 통해 노사가 SDGs 이행을 위해 공동으로 노력한 것 세계 최초 에너지 통합관리 플랫폼인 ‘KT MEG’를 통해 신재생에너지·전기차 충전 등 탄소 배출량 감소에 기여한 것 기후변화대응·감염병 등 위기상황에 대한 대응체계를 갖춘 것 양질의 교육과 일자리 증대에 기여하는 AI 기술을 개발한 것 코로나 19로 인한 비대면 환경에 대응하기 위해 AI VR·AR 블록체인 등 지능형 네트워크를 확산한 것 등이 높은 평가를 받았다고 밝혔다. 이번 글로벌지수에서 KT가 선정된 1위그룹과 최우수그룹 상위그룹 등은 향후 UN SDGs의 다양한 플랫폼을 통해 국제사회의 주요 지속가능경영 사례로 소개될 예정이다. 협회의 ‘환경·사회·지배구조 ESG Environmental·Social·Governance 인증서’도 수여된다. 또 매년 5월 발표되는 국제 친환경 인증인 ‘GRP 플라스틱 저감 및 기후변화대응 가이드라인 ’의 파트너기업으로 추천된다.,https://news.naver.com/main/read.nhn?mode=LSD&mid=sec&sid1=105&oid=138&aid=0002093959
