20201101,IT과학,블로터,SK그룹 8개사 재생에너지 100% 도전...RE100 가입,30일 SK머티리얼즈 본사를 찾은 최태원 SK 회장 사진 SK SK하이닉스를 포함한 SK그룹 8개사가 재생에너지로 전력 수요 100%를 대체하는 ‘RE100 Renewable Energy 100 ’에 국내 최초로 가입한다. 최태원 SK그룹 회장이 최근 강조한 ‘ESG 환경·사회·지배구조 ’ 경영 현실화의 일환으로 풀이된다. RE100 가입은 기업이 2050년까지 사용 전력의 100%를 태양광과 풍력 같은 재생에너지로 조달하겠다는 뜻을 공표하는 것이다. 2014년 영국의 다국적 비영리기구 ‘더 클라이밋’으로부터 시작돼 현재 구글 애플 이케아 등 전세계 260여개 기업이 가입하고 있다. SK그룹은 오는 2일 한국 RE100 위원회에 가입 신청서를 제출할 예정이다. SK주식회사 SK텔레콤 SK하이닉스 SKC SK실트론 SK머티리얼즈 SK브로드밴드 SK아이티테크놀로지가 포함된다. 또 화석연료 사업자로서 가입 조건에 해당하지 않는 SK E S SK에너지 SK가스 등 에너지 관련 주요 계열사들도 RE100에 준하는 목표를 자체적으로 세우고 재생에너지 사용을 확대할 방침이다. SK이노베이션 배터리 사업부 역시 ‘회사 단위 가입’이라는 RE100 가입 조건에 부합하지 못하지만 마찬가지로 자체 기준을 마련해 RE100 수준의 재생에너지 조달을 가속할 예정이다. 한편 가입신청서가 제출되면 더 클라이밋 그룹의 검토를 거친 후 최종 가입이 확정된다. 이후 1년 안에 이행 계획을 제출하고 매년 이행 상황을 점검받게 되며 SK그룹은 향후 정부가 시행 준비 중인 방안들과도 연계해 재생에너지 사용 비율을 늘려나갈 계획이다. SK그룹은 RE100 가입으로 ‘친환경 기업’ 브랜드를 강화함과 동시에 미국과 유럽 등 글로벌 기업들의 공급망 관리 강화 대응에서도 앞설 수 있을 것으로 기대한다고 밝혔다. 또 최근 글로벌 정세에서 저탄소 친환경 경영 도입 목소리가 커지고 있는 상황인 만큼 해외 시장 의존도가 높은 한국은 친환경 경영 전환 필요성이 더욱 높은 상황이다.,https://news.naver.com/main/read.nhn?mode=LSD&mid=sec&sid1=105&oid=293&aid=0000031635
20201101,IT과학,전자신문,수소드론 선도기업 DMI 모델 다양화 추진...2종 추가 출시 계획,두산모빌리티이노베이션이 수소연료전지 파워팩 DM15를 기반으로 개발하는 고정익 수소드론 DS25. 올해 12월 출시 예정이다. 수소드론 선도기업 두산모빌리티이노베이션 DMI 이 제품을 추가 출시 라인업을 강화한다. 고정익 수소드론을 올 연말 출시하고 내년 1분기에는 기존 제품 편의성을 개선한 수소드론을 내놓을 예정이다. 1일 DMI에 따르면 회사는 고정익 수소드론 DJ25 를 내달 출시하고 내년 3월 말에는 DS30 W 를 선보일 계획이다. DJ25는 고정익 수소드론으로 항공기처럼 날개가 있는 게 특징이다. 날개 상단에는 4개의 프로펠러가 위치한다. 날개가 있어 회전익 드론보다 더 오랜 시간 비행이 가능하다. 회전익처럼 물건을 운반하긴 어렵지만 상공에서 지상 모니터링 임무를 수행하는 데 유리하다. DJ25는 DMI가 최근 출시한 드론용 수소연료전지 파워팩 DM15 기반이다. DM15는 DM30 소형 버전이다. 무게는 3.25㎏이고 정격 출력은 1.35㎾다. 제한된 무게 내에서 긴 제품 수명과 높은 안정성을 달성하는 데 초점을 맞춰 개발된 제품이다. 주력 수소드론인 DS30 개선품 DS30 W 도 준비 중이다. 악천후 영향을 적게 받도록 성능을 끌어올린다. 방수 기능을 추가하고 내풍성도 속도 등 성능을 전반적으로 개선한다. 이는 물류 분야 등 상업용 드론 시장을 고려한 조치다. 드론 팔 탈부착 페이로드 포트 플라이컨트롤 장착 등 사용 편의성 개선도 이뤄진다. 현재 판매 중인 수소드론 DS30. 두산모빌리티이노베이션은 내년 3월 말께 DS30의 성능 및 편의성을 개선한 DS30 W를 출시할 계획이다. 미국 시장에서 영업력을 강화하기 위해 파트너사도 늘렸다. 지난달 플로리다주 딜러사로 에어로나이드와 계약을 체결했다. 르무스 포트리스 UAV MFE 렌탈을 포함해 총 4곳으로 확대했다. 현재는 딜러사가 수도드론 유지보수까지 담당하지만 향후 DMI 직접 진출도 고려한다. 이미 중국엔 지점을 냈고 다른 국가는 사업 성과에 따라 지점 설립을 검토한다. DS30 상업용 드론 활용을 위해 전용 낙하산도 개발 중이다. 미국과 영국 등에선 상업용 드론이 사람 위를 비행하려면 안전사고 예방을 위한 낙하산 시스템을 장착해야 한다. 낙하산 개발은 국내 드론 낙하산 제조 전문업체 헥사팩토리가 맡았다. DMI는 수소드론이 상업용 드론 시장에서 잠재력이 크다고 자신했다. 실제 DS30 기준 비행시간은 2시간으로 배터리 드론의 10 30분보다 오래 날 수 있다. 또 별도 충전 없이 10분 이내로 수소용기만 교체하면 비행을 이어갈 수 있다. DMI는 물류기업을 비롯한 다양한 글로벌 업체를 상대로 영업 활동을 이어가고 있다. 올해는 코로나19 영향으로 하늘길이 막히는 등 대면 영업에 지장이 있어 영상 회의를 포함한 온라인 채널을 적극 활용했다. DMI 관계자는 “미국 등 해외에서 콘셉트 검증 POC 을 진행하는 등 영업을 강화할 계획”이라며 “수소드론이 활용될 수 있는 분야라면 어떤 업체와도 협력할 수 있다”고 말했다. 한편 DMI는 수소드론뿐 아니라 수소드론을 만들려는 업체를 상대로 DM15 DM30 DP30 등 수소연료전지 파워팩도 판매한다.,https://news.naver.com/main/read.nhn?mode=LSD&mid=sec&sid1=105&oid=030&aid=0002910617
20201101,IT과학,전자신문,이준호 화웨이 CSO 5G 보안 밸류체인 전 부문 협력해야,“5세대 5G 이동통신 보안 위협에 대비하기 위해 밸류체인 전 부문이 표준 규제 제품 개발에 참여하는 협력체계를 구축해야 한다”. 이준호 한국화웨이 최고보안책임자 CSO 전무 는 “5G 보안의 완성은 보편적으로 인정할 수 있는 보안 신뢰 체계를 구축하는 데서 시작된다”며 이같이 역설했다. 이 전무는 △악성코드 펌웨어 해킹 디바이스 탬퍼링 IoT 봇넷 감염 디바이스 보안 위협 △디도스 DDoS 공격과 무선 신호 채널에 대한 재밍 공격과 허위 기지국을 통한 사용자 위치 정보 탈취 전송 정보의 변조 무선 액세스 보안 위협 △네트워크 슬라이싱 및 다중 엑세스 에지 컴퓨팅 MEC 공격 코어망 보안 위협 △인터넷 서비스 사업자나 이동통신 사업자 5G 수직산업 사업자 공격 외부연결 및 애플리케이션의 보안 위협 을 5G 보안 위협으로 예상했다. 그는 “이같은 보안 위협으로부터 5G 네트워크 사용자 트래픽과 서비스를 보호하기 위해 새로운 보안기술을 설계하고 솔루션을 개발 구축 운영해야 한다”며 “표준화 단계에서 국가간 네트워크와 시스템의 상호 연동을 위해 통신 프로토콜과 인터페이스를 안전하게 설계하고 장비 개발 제조사는 표준에서 요구하는 보안 기준에 맞는 장비를 개발해야 한다”고 제언했다. 이어 “통신 사업자는 장비 제조사의 통신장비와 서비스 애플리케이션이 보안 요구사항에 맞게 구현됐는지 공급망 제품을 검증해 안전한 네트워크 서비스를 설계·구축해야 한다”며 “서비스 운영 단계에서는 고도화되고 지능화된 사이버공격에 대한 취약점을 제거하고 침해사고에 대한 복원력을 강화해야 한다”고 주문했다. 이 전무는 또 “유럽연합 EU 의 5G PPP에서 제시한 5G 보안 아키텍처에 따르면 장비개발 구축 단계에서 네트워크 도메인을 비롯한 수평적 보안이 중요하다”며 “사용자 단말 장치 UE 동일 플랫폼 상의 수직적으로 존재하는 HW 제조사 보안영역 USIM 보안 애플리케이션 ID 보안 슬라이스 서비스 보안 기능 또한 일관되게 유지해야 한다”고 설명했다. 이 전무는 “5G보안 위협을 통제 가능한 수준으로 유지하기 위해 장비 제조사 통신사 등 밸류체인 참여자 각각의 역할을 수행해야 한다”며 “모두가 참여해 각자 책임과 통일된 표준을 정의하고 명확한 규제 조치를 제정할 때 모두가 인정할 수 있는 보안 신뢰 체계를 구축할 수 있다”고 역설했다. 화웨이의 보안 정책과 관련해선 “2010년부터 보안 표준과 고객 정부가 요구하는 네트워크 보안 사항을 참고해 통합적 장비 개발 프로세스 IPD 에 네트워크 보안 조치를 추가했다”며 “설계 단계에서 최고 솔루션 중 하나인 스트라이드 위협 모델링 방법을 도입했고 공격 트리와 프라이버시 PIA 요소를 첨가해 화웨이만의 ASTRIDE 위협 모델링 설계 방법론을 만들었다”고 소개했다. 이어 “통신사의 핵심 정보 인프라에서 네트워크 유연성 관리를 위해 상무부 소속 국립표준기술연구소의 CSF 프레임워크를 참고해 네트워크 유연성 구축 방법론 IPDDR 알고리즘을 활용 네트워크 서비스에서의 핵심 리스크를 제어하고 있다”고 말했다. 이 전무는 “화웨이가 270개 이상 보안 인증서를 취득했다”며 “5G장비와 관련해 5월 통신 장비 제조사 최초로 CC Common Criteria EAL4 인증 획득했고 8월에는 5G 무선 기지국 5G RAN gNodeB 5G 코어 네트워크 장비 등 화웨이의 네트워크 장비에 대해 세계이동통신사업자협회 GSMA 와 3GPP가 공동 제정한 네트워크 장비 보안 보증 체계 NESAS Network Equipment Security Assurance Scheme 를 통과했다”고 설명했다.,https://news.naver.com/main/read.nhn?mode=LSD&mid=sec&sid1=105&oid=030&aid=0002910616
20201101,IT과학,전자신문,SK브로드밴드의 맞불…“넷플릭스 통신망 이용료 돌려달라”,넷플릭스 채무부존재 확인소송 대응 SK브로드밴드 부당이득반환 맞소송 통신사 CP 접속료·전송료 개념 공방 망 이용대가 법률 해석 최대 쟁점으로 ⓒ게티이미지뱅크 SK브로드밴드가 넷플릭스에 부당 이득을 반환하라며 맞소송 반소 을 제기한다. 넷플릭스가 망 이용대가를 내지 않고 통신망 자원을 공짜로 사용했으므로 이를 돌려달라는 취지다. SK브로드밴드 측 변호사는 “넷플릭스를 상대로 반소를 청구할 예정”이라고 밝혔다. SK브로드밴드는 넷플릭스가 무료로 통신망을 이용하며 얻은 경제적 이익을 정산이 완료되는대로 구체적 금액을 제시해 청구할 것으로 관측된다. SK브로드밴드에 지불할 계약관계와 채무가 없다는 넷플릭스 주장에 대한 방어를 넘어 부당이득 반환 이라는 새로운 의제를 제시하며 공세에 나서겠다는 의지로 풀이된다. 넷플릭스가 소비자에 대한 콘텐츠 전달은 전적으로 통신사 책임이라며 맞서고 있는 가운데 SK브로드밴드와 넷플릭스 소송전은 글로벌 시장에서 망 이용대가 법적 개념을 정립하는 계기가 될 전망이다. 서울중앙지방법원에서 넷플릭스가 SK브로드밴드를 상대로 제기한 채무부존재 확인소송 첫 변론에서 양측은 치열한 공방을 전개했다. 재판에서는 양측간 채무 존재여부와 규모를 가리기에 앞서 망 이용대가 개념을 정의하는 일이 최우선 과제로 지목됐다. 넷플릭스는 인터넷 시장에서 접속료 와 전송료 개념을 구분해야 한다는 입장이다. 인터넷 이용자와 CP는 인터넷 접속을 위한 요금인 접속료를 통신사에 지불한다. 통신사는 이렇게 전달받은 콘텐츠를 다른 이용자 또는 통신망으로 전송하는 의무를 지닌다. 이용자와 CP 입장에서는 접속료를 지불했으므로 전송료에 대해서는 지불할 필요가 없다는 논지다. 넷플릭스 측 변호사는 “가입자에게 콘텐츠를 전송시키는 것은 통신사가 소비자와 계약관계에서 당연히 부담해야할 의무”라면서 “전송료를 CP에게 요구하는 것은 책임을 전가하는 행위”라고 주장했다. 반면에 SK브로드밴드는 인터넷 시장에서 망 이용대가를 접속료와 전송료로 구분하는 것은 무의미하며 본질을 흐리는 행위라고 주장했다. 인터넷 시장의 3대 주체는 이용자와 통신사 CP로 정의된다. 인터넷 시장 양면시장 속성상 이용자와 CP가 통신망에 연결하기 위해서는 대가 지불이 필연적이다. CP가 합당한 망 이용대가를 내야 다른 쪽 종단에 위치한 소비자에 부담을 전가하지 않은채 통신망을 안정적으로 운영 가능하다는 논리다. 미국 워싱턴D.C. 연방항소법원은 인터넷시장의 양면시장 속성을 인정 통신사가 CP에 망 이용대가를 부과하는 게 정당하다고 판시했다. SK브로드밴드 측 변호사는 “기본적으로 망이용대가에는 접속료와 전송료가 모두 포함돼 있고 인터넷망 연결을 위해서는 반드시 비용을 지불해야 한다”면서 “넷플릭스는 콘텐츠전송네트워크 CDN 를 통해 SK브로드밴드 망에 직접 연결돼 있고 그에 대한 대가를 요구하는 것이 요지”라고 말했다. 양측은 2차 변론 기일에서 망 이용대가에 대해 보다 세밀한 정의를 바탕으로 변론을 전개한다. 소송에서 제시될 망 이용대가에 대한 법적인 개념과 법원의 판단에 세계 시장과 규제당국 눈길이 쏠린다. 정보통신기술 ICT 강국인 우리나라에서의 판결은 미국 법원 판결에 이어 세계시장에서 준거가 될 가능성이 높다.,https://news.naver.com/main/read.nhn?mode=LSD&mid=sec&sid1=105&oid=030&aid=0002910613
20201101,IT과학,전자신문,기획 에너지 효율을 생각한다면 LG 휘센 시스템에어컨,LG전자가 선보인 사무실 공조 솔루션. 에너지소비효율 1등급 휘센 인공지능 듀얼베인 시스템에어컨은 큰 먼지를 걸러주는 필터가 있는 전면 그릴을 천장에서 밑으로 내릴 수 있어 청소가 간편하다. LG전자는 지난해 싱글타입 천장형 시스템에어컨 최초로 에너지소비효율 1등급을 달성한 휘센 인공지능 듀얼베인 시스템에어컨 을 선보인 데 이어 올해는 업계 최초로 상업용 스탠드 에어컨도 1등급 신제품을 출시하며 시장을 선도하고 있다. ◇공간과 상황에 맞춰 6가지 공간맞춤기류 구현 LG 휘센 인공지능 듀얼베인 시스템에어컨은 국내 최초로 천장형 시스템에어컨에 듀얼베인 Dual Vane 을 갖춰 6가지 공간맞춤기류를 제공한다. 베인은 기류를 조절하는 날개다. 듀얼베인은 기존 천장형 실내기에 설치된 4개의 베인과는 별도로 제품 내부에도 4개의 베인을 추가해 바람 방향을 더욱 정밀하게 조절할 수 있다. 이 기술은 한국산업기술진흥협회가 우수한 신기술에 부여하는 NET New Excellent Technology 인증을 받았다. 사용자는 공간과 상황에 맞춰 △바람막이인 에어가이드 를 따로 설치한 것처럼 간접풍을 불어주는 모드 △3 4m에 불과한 기존 제품들과 달리 바닥 방향 5m까지 따뜻한 바람이 도달하는 모드 △실내 온도변화에 따라 바람의 세기를 스스로 조절해 실내를 항상 쾌적하게 유지하는 모드 △온도 풍량 풍향 변화를 통해 뇌파 변화를 유도해 집중력을 높여주는 모드 △설정온도 도달시간이 기존보다 약 40% 단축될 정도로 냉방 성능이 강력한 모드 △숲 속의 편안한 바람처럼 실내에 오래 머물러도 상쾌한 모드 등을 맞춤형으로 이용할 수 있다. LG 휘센 인공지능 듀얼베인 시스템에어컨은 국내 최초로 천장형 시스템 에어컨에 듀얼베인 Dual Vane 을 갖춰 6가지 공간맞춤기류를 제공한다. LG전자는 신제품에 업계 최고수준 기술력을 보유한 인버터 제어 효율과 내구성은 높이고 소음은 줄여주는 R1 압축기 냉난방 효율을 높여주는 고집적 열교환기 등 최신 에너지기술을 집약했다. 이 제품은 2018년 10월 개정된 기준에 따라 싱글타입 시스템에어컨 최초로 에너지소비효율 1등급을 달성했다. 기존보다 냉방효율은 최대 20% 난방효율은 최대 37% 향상됐다. 싱글타입 시스템에어컨은 실내기 실외기 각 한 대로 구성돼 오피스텔 원룸 등에서 인기 있는 제품이다. LG 휘센 인공지능 듀얼베인 시스템에어컨은 편리한 인공지능 기술도 대거 탑재했다. 바닥온도 감지센서는 바닥온도와 실내기 온도를 감지해 공간의 온도를 계산하고 실내 전체공간을 균일하게 난방한다. 인체 감지센서는 고객의 위치를 감지해 사람이 있는 곳으로 시원한 바람을 보내는 직접바람은 물론 바람이 직접 닿지 않도록 사람이 없는 곳으로 바람을 보내는 간접바람을 모두 제공한다. 실내에 사람이 있는지 감지해 사람이 없을 경우 알아서 운전을 멈춘다. 와이파이를 기본 탑재해 스마트폰으로 에어컨을 원격 제어할 수 있으며 에너지사용량도 확인할 수 있다. 이 제품은 공기청정 성능도 뛰어나 사계절 공기청정기로도 손색이 없다. 최대 45.7평 150.9㎡ 공간의 공기를 깨끗하게 관리할 수 있다. 아주 작은 극초미세먼지까지 실시간으로 정밀하게 감지할 수 있는 PM 1.0 센서를 탑재했다. 큰 먼지를 걸러주는 프리필터를 원터치로 분리해 손쉽게 청소할 수 있는 것도 장점이다. 사용자는 실내기 LED표시등 리모컨 스마트폰 등으로 편리하게 실내 공기질을 실시간으로 확인할 수 있다. LG 휘센 상업용 스탠드 에어컨 신제품은 에너지소비효율 1등급을 달성했다. 기존보다 냉방효율은 최대 34% 난방효율은 최대 42% 뛰어나다. ◇상업용 스탠드 에어컨 신기술로 냉난방 성능·효율 향상 LG전자는 올해 6월 업계 최초로 에너지소비효율 1등급을 달성한 상업용 스탠드 에어컨을 국내 출시했다. 차별화된 신기술을 도입해 휘센 상업용 스탠드 에어컨 PW083PT2SR 의 냉·난방 성능과 효율을 대폭 높였다. 베이퍼 인젝션 Vapor Injection 기술은 냉매를 압축할 때 일부 냉매를 분리해 기체로 바꾼 후 주입하는 방식으로 냉·난방 성능과 효율을 높여준다. 이 기술은 기화된 냉매를 한 번 더 압축하는 효과가 있어 에어컨의 효율이 올라가게 된다. 신제품은 액체 냉매를 기체로 바꿔주는 증발기에 액체 냉매와 기체 냉매를 분리하는 증발기액분리 기술을 적용해 난방성능을 향상시켰다. 증발기에서 기체 냉매를 뽑아내는 기술은 배관에 흐르는 냉매의 압력이 손실되는 것을 줄여 에어컨의 난방성능을 높여준다. 에너지 효율을 높여주는 인버터 제어기술도 신제품이 에너지소비효율 1등급을 획득하는 데 기여했다. 이 제품은 2018년 10월 에너지소비효율등급 기준이 강화된 후 실내기를 1대 쓰는 싱글타입 상업용 스탠드 에어컨에서 국내 첫 1등급을 획득했다. 신제품은 기존보다 냉방효율은 최대 34% 난방효율은 최대 42% 뛰어나다. 또 이 제품은 효율과 내구성은 높이고 소음은 줄여주는 R1 압축기를 탑재했고 실내기에 습도센서를 탑재해 온도뿐 아니라 실내 습도까지 고려해 쾌적하게 냉방한다. LG전자는 세계적인 디자인상인 레드닷 Reddot 디자인 어워드에서 2013년 본상을 수상한 상업용 스탠드 에어컨 디자인을 신제품에 적용했다. 모던한 디자인은 인테리어와 조화를 이루며 공간의 품격을 높여준다. 고객들은 와이파이를 탑재한 신제품을 스마트폰의 LG 씽큐 LG ThinQ 앱과 연결하면 언제 어디서나 에어컨을 모니터링하고 제어할 수 있다. 블랙박스 기능은 오작동이 일어난 순간의 운전상태에 관한 데이터를 저장해 원인분석이 빠르고 수월하다.,https://news.naver.com/main/read.nhn?mode=LSD&mid=sec&sid1=105&oid=030&aid=0002910611
20201101,IT과학,디지털타임스,중기부 소상공인 교육 위한 ‘영상콘텐츠’ 공모,중소벤처기업부는 2일부터 30일까지 소상공인 온라인 교육영상 콘텐츠 공모전 을 연다고 1일 밝혔다. 이 공모전은 개인이 팀 단위로 소상공인의 창업 사업 진행 과정 등에 필요한 정보 지식을 담아 강연 다큐멘터리 등 다양한 형태의 영상 콘텐츠로 제작 응모하면 된다. 평가는 신사업창업사관학교 교육생과 소상공인 지식배움터 사용자 등 대국민이 참여해 진행한다. 시상은 대상 1팀 중기부 장관상과 상금 300만원 최우수상 등 총 16개팀을 선정 상장과 상금을 수여한다. 수상작은 소상공인 지식배움터 온라인교육 콘텐츠로 등재 활용할 계획이다. 배석희 중기부 소상공인경영지원과장은 앞으로 소상공인의 교육 기회를 확대하고 디지털 활용에 어려움을 겪는 소상공인을 위한 교육 프로그램을 확충해 나가겠다 고 말했다.,https://news.naver.com/main/read.nhn?mode=LSD&mid=sec&sid1=105&oid=029&aid=0002633629
20201101,IT과학,국민일보,삼성 스마트폰 1위 탈환…화웨이·애플↓ 샤오미는↑,카날리스 스마트폰 시장 삼성 1위 화웨이 2위 미국 제재 여파와 중저가폰 선전 주효한듯 3분기 글로벌 스마트폰 시장 점유율. 카날리스 제공 삼성전자가 한 분기 만에 글로벌 스마트폰 시장 점유율 1위를 되찾은 것으로 나타났다. 경쟁업체인 화웨이가 미국의 제재로 본격 하락세에 접어들었고 중저가 스마트폰을 출시하며 가격 다변화에 나선 것이 주효했다. 1일 시장조사기관 카날리스에 따르면 삼성전자의 3분기 전 세계 스마트폰 출하량은 8020만대 점유율 23%로 다시 1위에 올랐다. 카날리스는 “삼성은 2분기 오프라인 유통에 의존하면서 어려움을 겪었지만 3분기에는 큰 회복세를 보였다”며 “많은 지역에서 억제된 수요가 3분기에 터져나왔다 Pent up ”고 분석했다. 삼성은 온라인 판매 강화에 나서면서 상승세를 이어갈 것으로 기관은 내다봤다. 유혈 사태로 인한 인도에서의 반중 감정 역시 삼성의 선전으로 이어졌다. 중저가 기기가 강세를 보이는 인도 스마트폰 시장은 3분기 5000만대 규모로 급성장하고 있다. 삼성 보급형 라인인 갤럭시A 시리즈와 M시리즈가 선전하고 있다. 전 분기 선두였던 화웨이의 3분기 출하량은 5170만대로 점유율 14.9%를 나타냈다. 미 제재 여파로 출하 규모가 지난해보다 23%나 감소했다. 화웨이의 물량 감소분은 같은 중국 업체인 샤오미가 대부분 흡수한 것으로 카날리스는 분석했다. 카날리스는 “화웨이가 1510만대를 잃었고 샤오미가 1450만대를 추가하는 등 대칭성이 있었다”며 “특히 핵심 격전지인 유럽에서 화웨이 출하량은 25% 감소한 반면 샤오미는 88% 성장했다”고 설명했다. 업체별 3분기 스마트폰 출하량과 점유율. 지난해 같은 기간 대비 샤오미는 45% 성장한 반면 화웨이는 23% 하락했다. 카날리스 제공 화웨이의 빈자리는 국내 업체들도 노리고 있다. LG전자는 보급형 제품 라인업을 늘리며 북미·중남미 시장을 집중 공략하고 있다. LG전자는 30일 실적 발표 후 컨퍼런스콜에서 “멕시코를 포함한 중남미 지역에서 경쟁력이 개선된 보급형 모델로 기존 화웨이 슬롯을 대체할 것”이라고 강조했다. 애플은 4320만대 12.4% 를 출하하며 샤오미에 뒤진 4위로 밀려났다. 애플은 29일 현지시간 3분기 실적 발표에서 아이폰 매출이 전년 동기 대비 20.75% 감소했다고 밝혔다. 코로나19로 물량 공급에 차질이 빚어지면서 아이폰12 출시가 늦어졌기 때문이다. 다만 업계는 애플의 점유율이 빠른 속도로 회복될 보고 있다. 팀 쿡 최고경영자 CEO 는 “5G 이동통신을 지원하는 등 아이폰12 초기 판매량은 좋다”며 이 같은 전망을 뒷받침했다. 한편 전 세계 스마트폰 출하량은 3억4810만대로 전 분기 대비 22% 상승했다. 전년 같은 기간과 비교하면 1% 감소한 수치지만 코로나19 이후 빠른 속도로 판매량을 회복하고 있다.,https://news.naver.com/main/read.nhn?mode=LSD&mid=sec&sid1=105&oid=005&aid=0001376436
